{"analysis_policy":{"clash_detector_id":"bms_clash","clash_detector_version":"1","clash_free_minimum":0.9,"inner_support_minimum":0.6,"minimum_common_ranked_universe_size":3,"outer_support_minimum":0.8,"rank_stability_minimum":0.6,"sign_consistency_minimum":0.8,"sign_zero_epsilon":1e-06},"backend":"confornets","confornets":{"backend_identity":{"backend_commit":"3333333333333333333333333333333333333333","backend_version":"fixture-1","container_digest":"sha256:4444444444444444444444444444444444444444444444444444444444444444","feature_identity_sha256":"5555555555555555555555555555555555555555555555555555555555555555","model_id":"confornets-fixture","repo_path":"/opt/confornets","runtime_identity":"python3-controlled-confornets"},"benchmark_name":"fixture","chain_id":"A","checkpoint":{"path":"inputs/checkpoint.pt","sha256":"c05605510f48cd05303c09f8408bac207f2608e259f2568f5d02bef58ca211d3"},"compute_confidence":true,"compute_evaluation":true,"config":null,"confornet_count":1,"gradient_clip":10.0,"learning_rate":0.001,"max_steps":10,"num_diffusion_steps":20,"num_recycles":0,"references":[{"content_sha256":"c64b53b1dabafdc369c2c553425358e473d2f54005bd2c45cde756f8049f7085","reference_id":"open","source":"authenticated_upload","staged_path":"inputs/open.pdb","state":"open"},{"content_sha256":"0552c4e7d59027d3ec1e2c6542e5cb8381263624e925c62fe34bb806e7a24445","reference_id":"closed","source":"authenticated_upload","staged_path":"inputs/closed.pdb","state":"closed"}],"runs":1,"samples":2,"save_full_confidence":false,"saved_steps":[5,10],"sequence":"MKT","skip_msa":true,"task":"mse","test_case_id":"case-a","transfer_source":null},"created_by":{"principal_id":"phase4-fixture"},"feature_policy":{"mode":"features_disabled_control_v1"},"ordered_seeds":[101],"request_id":"00000000-0000-4000-8000-000000000044","request_sha256":"edf1edfcd8c02f09708fb0cb4b46b3316ef95d0fe28899676c443fd9b3569b9b","runtime_policy":{"use_default_params":true},"samples_per_seed":2,"schema_name":"cm_request","schema_version":1,"source":{"kind":"controlled_contract_fixture_v1","sha256":"aaaaaaaaaaaaaaaaaaaaaaaaaaaaaaaaaaaaaaaaaaaaaaaaaaaaaaaaaaaaaaaa"},"targets":[{"chain_count":1,"molecule_type":"protein","sequence":"MKT","target_id":"target-a","target_order":0}]}
